{
  "plan_id": "PLAN-PPT-demo",
  "project": "demo-project",
  "phase": "ppt",
  "level": "task",
  "created_at": "2026-07-12T14:05:09.505014",
  "token_budget": {
    "total_available": 1048576,
    "per_vm": 1048576,
    "safety_margin": 0.3,
    "usable_per_vm": 733803
  },
  "assessment": {
    "input_size_estimate": 50000,
    "output_size_estimate": 10000,
    "total_estimate": 60000,
    "verdict": "level_ok"
  },
  "items": [
    {
      "task_id": "ppt-001",
      "level": "task",
      "assignee": "vm3",
      "estimated_tokens": 35000,
      "depends_on": [
        "design-007-diagrams"
      ],
      "description": "PPT制作"
    },
    {
      "task_id": "check-ppt",
      "level": "task",
      "assignee": "vm2",
      "estimated_tokens": 18000,
      "depends_on": [
        "ppt-001"
      ],
      "description": "PPT检查+校审"
    }
  ],
  "reasoning": "PPT制作基于完整方案书提炼，单个VM足以完成。检查通过后推送后台文档，管线结束。"
}