{
  "plan_id": "PLAN-DESIGN-demo-project",
  "project": "demo-project",
  "phase": "design",
  "level": "stage",
  "created_at": "2026-07-12T15:37:03.763243",
  "token_budget": {
    "total_available": 3145728,
    "per_vm": 1048576,
    "safety_margin": 0.3,
    "usable_per_vm": 734003
  },
  "assessment": {
    "input_size_estimate": 50000,
    "output_size_estimate": 60000,
    "total_estimate": 110000,
    "verdict": "level_ok"
  },
  "items": [
    {
      "task_id": "design-001-requirement",
      "level": "stage",
      "assignee": "vm1",
      "estimated_tokens": 16000,
      "depends_on": [
        "framework-001-matrix",
        "framework-002-business"
      ],
      "description": "需求分析"
    },
    {
      "task_id": "design-002-overall",
      "level": "stage",
      "assignee": "vm2",
      "estimated_tokens": 20000,
      "depends_on": [
        "framework-003-system"
      ],
      "description": "总体方案"
    },
    {
      "task_id": "design-003-subproject",
      "level": "stage",
      "assignee": "vm3",
      "estimated_tokens": 25000,
      "depends_on": [
        "framework-003-system"
      ],
      "description": "分项方案"
    },
    {
      "task_id": "design-004-common",
      "level": "stage",
      "assignee": "vm1",
      "estimated_tokens": 13000,
      "depends_on": [
        "framework-003-system"
      ],
      "description": "公共部分"
    }
  ],
  "reasoning": "输入估算50K + 输出估算60K = 总需求110K, 可用730K/VM. 结论: level_ok. 采用stage级粒度."
}