{
  "plan_id": "PLAN-RESEARCH-demo",
  "project": "demo-project",
  "phase": "research",
  "level": "stage",
  "created_at": "2026-07-12T14:05:09.505014",
  "token_budget": {
    "total_available": 1048576,
    "per_vm": 1048576,
    "safety_margin": 0.3,
    "usable_per_vm": 733803
  },
  "assessment": {
    "input_size_estimate": 12000,
    "output_size_estimate": 18000,
    "total_estimate": 30000,
    "verdict": "level_ok"
  },
  "items": [
    {
      "task_id": "research-001-outline",
      "level": "task",
      "assignee": "vm1",
      "estimated_tokens": 12000,
      "depends_on": [],
      "description": "方案大纲编制"
    },
    {
      "task_id": "research-002-literature",
      "level": "task",
      "assignee": "vm2",
      "estimated_tokens": 16000,
      "depends_on": [],
      "description": "文献与标准调研"
    },
    {
      "task_id": "research-003-solution",
      "level": "task",
      "assignee": "vm3",
      "estimated_tokens": 20000,
      "depends_on": [],
      "description": "方案知识调研"
    },
    {
      "task_id": "check-research",
      "level": "task",
      "assignee": "vm1",
      "estimated_tokens": 12000,
      "depends_on": [
        "research-001-outline",
        "research-002-literature",
        "research-003-solution"
      ],
      "description": "调研阶段检查+校审"
    }
  ],
  "reasoning": "调研阶段3个子任务无依赖关系，并行分配3台VM。每个子任务预估token远低于可用量，无需继续拆分。"
}