{
  "plan_id": "PLAN-FRAMEWORK-demo-project",
  "project": "demo-project",
  "phase": "framework",
  "level": "stage",
  "created_at": "2026-07-12T15:37:03.196569",
  "token_budget": {
    "total_available": 3145728,
    "per_vm": 1048576,
    "safety_margin": 0.3,
    "usable_per_vm": 734003
  },
  "assessment": {
    "input_size_estimate": 30000,
    "output_size_estimate": 20000,
    "total_estimate": 50000,
    "verdict": "level_ok"
  },
  "items": [
    {
      "task_id": "framework-001-matrix",
      "level": "task",
      "assignee": "vm1",
      "estimated_tokens": 15000,
      "depends_on": [
        "research-001-outline",
        "research-003-solution"
      ],
      "description": "需求矩阵"
    },
    {
      "task_id": "framework-002-business",
      "level": "task",
      "assignee": "vm2",
      "estimated_tokens": 14000,
      "depends_on": [
        "research-002-literature"
      ],
      "description": "业务框架"
    },
    {
      "task_id": "framework-003-system",
      "level": "task",
      "assignee": "vm3",
      "estimated_tokens": 20000,
      "depends_on": [
        "research-001-outline",
        "research-003-solution"
      ],
      "description": "系统框架"
    },
    {
      "task_id": "check-framework",
      "level": "task",
      "assignee": "vm2",
      "estimated_tokens": 18000,
      "depends_on": [
        "framework-001-matrix",
        "framework-002-business",
        "framework-003-system"
      ],
      "description": "检查+校审"
    }
  ],
  "reasoning": "输入估算30K + 输出估算20K = 总需求50K, 可用732K/VM. 结论: level_ok. 采用stage级粒度."
}