{
  "plan_id": "PLAN-RESEARCH-demo-project",
  "project": "demo-project",
  "phase": "research",
  "level": "stage",
  "created_at": "2026-07-12T15:37:02.588436",
  "token_budget": {
    "total_available": 3145728,
    "per_vm": 1048576,
    "safety_margin": 0.3,
    "usable_per_vm": 734003
  },
  "assessment": {
    "input_size_estimate": 12000,
    "output_size_estimate": 18000,
    "total_estimate": 30000,
    "verdict": "level_ok"
  },
  "items": [
    {
      "task_id": "research-001-outline",
      "level": "task",
      "assignee": "vm1",
      "estimated_tokens": 12000,
      "depends_on": [],
      "description": "方案大纲"
    },
    {
      "task_id": "research-002-literature",
      "level": "task",
      "assignee": "vm2",
      "estimated_tokens": 16000,
      "depends_on": [],
      "description": "文献知识"
    },
    {
      "task_id": "research-003-solution",
      "level": "task",
      "assignee": "vm3",
      "estimated_tokens": 20000,
      "depends_on": [],
      "description": "方案知识"
    },
    {
      "task_id": "check-research",
      "level": "task",
      "assignee": "vm1",
      "estimated_tokens": 12000,
      "depends_on": [
        "research-001-outline",
        "research-002-literature",
        "research-003-solution"
      ],
      "description": "检查+校审"
    }
  ],
  "reasoning": "输入估算12K + 输出估算18K = 总需求30K, 可用734K/VM. 结论: level_ok. 采用stage级粒度."
}